### ISSUE TITLE
Diagnose firewall inter-cluster and nat-discovery not working on Azure clusters

### ISSUE THREAD

**Issue by sridhargaddam** [submariner-io/subctl#651]
**What happened**:

When `subctl diagnose firewall ...` `inter-cluster` as well as `nat-discovery` commands are executed on Azure OCP clusters, it was seen that even though the necessary ports were opened and all e2e tests were passing, the diagnose commands were returning error.

```
[sgaddam@localhost aws-ocp]$ subctl diagnose firewall inter-cluster --context sgaddam-azure-spoke1 --remotecontext sgaddam-azure-spoke2
 ✗ Checking if tunnels can be setup on the gateway node of cluster "sgaddam-azure-spoke1" 
 ✗ The tcpdump output from the sniffer pod does not include the message sent from client pod. Please check that your firewall configuration allows UDP/4500 traffic on the "subgw-southce-43b688-lswfm" node. Actual pod output: 
....a.....Z$BVS...8... ...%!S(MISSING)+...g.P.9...Psk.1."..X.Q.h
07:22:14.697006 eth0  In  IP 23.102.159.104.4500 > 30.0.128.6.4500: UDP-encap: ESP(spi=0xfa1d61db,seq=0x1b18), length 88
E..t..@.9....f.h.........`....a.....Z$BVS....o..!/.8fY.q"..d.!.xB...9.o^...#:.3.
07:22:14.697132 br-ex In  IP 23.102.159.104.4500 > 30.0.128.6.4500: UDP-encap: ESP(spi=0xfa1d61db,seq=0x1b18), length 88
E..t..@.9....f.h.........`....a.....Z$BVS....o..!/.8fY.q"..d.!.xB...9.o^...#:.3.
07:22:14.752752 eth0  In  IP 23.102.159.1... (truncated)
 ✗ Could not determine if Tunnels can be established on the gateway node of cluster "sgaddam-azure-spoke1"
Error running command: the tcpdump output from the sniffer pod does not include the message sent from client pod. Please check that your firewall configuration allows UDP/4500 traffic on the "subgw-southce-43b688-lswfm" node. Actual pod output: 
....a.....Z$BVS...8... ...%S+...g.P.9...Psk.1."..X.Q.h
07:22:14.697006 eth0  In  IP 23.102.159.104.4500 > 30.0.128.6.4500: UDP-encap: ESP(spi=0xfa1d61db,seq=0x1b18), length 88
E..t..@.9....f.h.........`....a.....Z$BVS....o..!/.8fY.q"..d.!.xB...9.o^...#:.3.
07:22:14.697132 br-ex In  IP 23.102.159.104.4500 > 30.0.128.6.4500: UDP-encap: ESP(spi=0xfa1d61db,seq=0x1b18), length 88
E..t..@.9....f.h.........`....a.....Z$BVS....o..!/.8fY.q"..d.!.xB...9.o^...#:.3.
07:22:14.752752 eth0  In  IP 23.102.159.1... (truncated)

subctl version: v0.15.0-rc0
```

```
[sgaddam@localhost aws-ocp]$ subctl diagnose firewall nat-discovery --context sgaddam-azure-spoke1 --remotecontext sgaddam-azure-spoke2
 ✗ Checking if nat-discovery port is opened on the gateway node of cluster "sgaddam-azure-spoke1" 
 ✗ The tcpdump output from the sniffer pod does not include the message sent from client pod. Please check that your firewall configuration allows UDP/4490 traffic on the "subgw-southce-43b688-lswfm" node. Actual pod output: 

 ✗ Could not determine if nat-discovery port is allowed in the cluster "sgaddam-azure-spoke1"
Error running command: the tcpdump output from the sniffer pod does not include the message sent from client pod. Please check that your firewall configuration allows UDP/4490 traffic on the "subgw-southce-43b688-lswfm" node. Actual pod output: 

subctl version: v0.15.0-rc0
```

**What you expected to happen**:
subctl diagnose firewall commands should report a message that the required firewall ports are opened.

**How to reproduce it (as minimally and precisely as possible)**:
Install OCP 4.12.10 version on Azure cloud and run the diagnose commands.
I found this issue as part of Submariner 0.15.0-rc0 test-day on Azure clusters and it might be even applicable to other cloud providers as well.

**Environment**:
- Diagnose information (use `subctl diagnose all`):
- Gather information (use `subctl gather`)
- Cloud provider or hardware configuration: Azure with OCP 4.12.10
- Install tools: subctl 0.15.0-rc0
- Others:

**Comment by dfarrell07** [comment]
Talking to @aswinsuryan about this, it seems we're stuck between port issues either way (4500 conflict if we move to the gateway node). The long-term answer is to move to LB mode. This is already documented.
